### ISSUE TITLE
Some questions

### ISSUE THREAD

**Issue by tilllt** [alangecker/bigbluebutton-docker#2]
After unsuccesfully trying several non working dockerfiles of BBB, i found your approach and it looks much more reasonable. I am in the process of building the images, but i wondered about this:

> Adjust the values in .env (don't forget to change the ETHERPAD_API_KEY, SHARED_SECRET and RAILS_SECRET!)

Were do i get these from? Do i need a working etherpad instance for BBB or is this part of the docker stack? Shared Secret of Coturn? Where do i get the Rails Secret from?

Sorry if these are obvious questions but this is the first time i am trying to install BBB so its not obvious to me (yet).

EDIT: so i used 
docker run --rm bigbluebutton/greenlight:v2 bundle exec rake secret

and put this into the .env file, like this:
SECRET_KEY_BASE=secretcrectresecretsecretcrectresecret
but i still get this: 
Serverfehler (Server Error)
BigBlueButton Endpunkt und Geheimnis ungültig (Endpoint and Secret invalid)

Thanks.

**Comment by nyok92** [comment]
Hi tillllt,
First for the 3 differents keys, you can write anything (i'v just modified some letter, numbers in the keys), it just has to be different than the ones in this repo (just for security, so that no one try to enter your server with the default credentials keys in the sample.env)
maybe you can genereate them with a openssl or another cli tool.

Ehterpad is part of this docker stack, you have nothing to add.
There is no Coturn in this stack. It just connects to a free public stun server:
stun.freeswitch.org 
STUN_IP=216.93.246.18
STUN_PORT=3478

Don't forget to change external_ip and domain

**Comment by tilllt** [comment]
It's working now - somehow - I forgot setting the domain name.

Quality is unusable so far. I think I have to significantly lower the audio / video bandwidths on the cheap contabo VPS (4cores / 10gb ram) since audio Is crackling like crazy

**Comment by tilllt** [comment]
Ha, one last question: since I am running my own coturn server anyway for nextcloud talk...

- How would I set the shared secret for the coturn server? Is there some extra variables not mentioned in the example file that would me allow to do this?

**Comment by alangecker** [comment]
currently there is no variable for setting a turn server, but you can override the corresponding file in `core`. This is possible by adding one line in `docker-compose.yml` under `services.core.volumes` and creating a file called `conf/turn-stun-servers.xml`

```diff
diff --git a/docker-compose.yml b/docker-compose.yml
index 0534adb..8cc2a78 100644
--- a/docker-compose.yml
+++ b/docker-compose.yml
@@ -24,6 +24,7 @@ services:
       - /sys/fs/cgroup:/sys/fs/cgroup:ro # for systemd
       - ./conf/sip_profiles:/opt/freeswitch/conf/sip_profiles/external
       - ./conf/dialplan_public:/opt/freeswitch/conf/dialplan/public_docker
+      - ./conf/turn-stun-servers.xml:/usr/share/bbb-web/WEB-INF/classes/spring/turn-stun-servers.xml
     network_mode: host
```

and here you can find a example how the xml file can be configured for a turn server: https://github.com/dkrenn/bigbluebutton/blob/dockerize-components/bigbluebutton-web/turn-stun-servers.xml.tmpl

default content is: https://github.com/alangecker/bbb-packages/blob/master/bbb-web/data/usr/share/bbb-web/WEB-INF/classes/spring/turn-stun-servers.xml

**Comment by tilllt** [comment]
Thanks, i added my coturn server and then, in an attempt to see if it works, i looked at the logs of the bbb_core and saw (a lot of) this... what is this? There are no calls going on on my server.

`May 05 10:29:14 vmd53353.contaboserver.net bbb-apps-akka[103]: 2020-05-05T10:29:14.621Z INFO  o.b.core2.AnalyticsActor - -- analytics -- {"envelope":{"name":"VoiceConfCallStateEvtMsg","routing":{"voiceConf":"00046192777664"},"timestamp":1588674554618},"core":{"header":{"name":"VoiceConfCallStateEvtMsg","voiceConf":"00046192777664"},"body":{"voiceConf":"00046192777664","callSession":"419e753e-be16-426e-816c-1da249d4ee2f","clientSession":"0","userId":"","callerName":"7646996940","callState":"CALL_STARTED","origCallerIdName":"7646996940","origCalledDest":"00046192777664"}}}
May 05 10:29:14 vmd53353.contaboserver.net bbb-apps-akka[103]: 2020-05-05T10:29:14.622Z INFO  o.b.core2.AnalyticsActor - -- analytics -- {"envelope":{"name":"VoiceConfCallStateEvtMsg","routing":{"voiceConf":"00046192777664"},"timestamp":1588674554619},"core":{"header":{"name":"VoiceConfCallStateEvtMsg","voiceConf":"00046192777664"},"body":{"voiceConf":"00046192777664","callSession":"419e753e-be16-426e-816c-1da249d4ee2f","clientSession":"0","userId":"","callerName":"7646996940","callState":"CALL_ENDED","origCallerIdName":"7646996940","origCalledDest":"00046192777664"}}}`

**Comment by alangecker** [comment]
> Thanks, i added my coturn server and then, in an attempt to see if it works, i looked at the logs of the bbb_core and saw (a lot of) this... what is this? There are no calls going on on my server.

hmm, i can't see any issue here. can you describe the issue a little bit more? does the echo test work?

**Comment by tilllt** [comment]
The "issue" is that there is a lot of info logged about calls being started and stopped. I don't understand where these are coming from when there is no call happening on my server. Whose calls are those and why do they appear in my logs?

**Comment by alangecker** [comment]
maybe have a look into `tcpdump udp and dst port 5060`

```
root@meet:~# tcpdump udp and dst port 5060
tcpdump: verbose output suppressed, use -v or -vv for full protocol decode
listening on ens3, link-type EN10MB (Ethernet), capture size 262144 bytes
13:18:37.626685 IP ▮▮▮▮▮▮▮▮▮▮▮▮.50286 > 192.168.122.20.sip: SIP: INVITE sip:9004▮▮▮▮▮2854@144.76.▮▮▮▮▮ SIP/2.0
13:18:38.104122 IP ▮▮▮▮▮▮▮▮▮▮▮▮.62500 > 192.168.122.20.sip: SIP: REGISTER sip:144.76.▮▮▮▮▮ SIP/2.0
13:18:38.127254 IP ▮▮▮▮▮▮▮▮▮▮▮▮.62500 > 192.168.122.20.sip: SIP: REGISTER sip:144.76.▮▮▮▮▮ SIP/2.0
13:18:45.457954 IP ▮▮▮▮▮▮▮▮▮▮▮▮.65069 > 192.168.122.20.sip: SIP: INVITE sip:00485▮▮▮▮▮3004@144.76.▮▮▮▮▮ SIP/2.0
13:18:46.938155 IP ▮▮▮▮▮▮▮▮▮▮▮▮.54540 > 192.168.122.20.sip: SIP: INVITE sip:90044▮▮▮▮▮787310@144.76.▮▮▮▮▮ SIP/2.0
13:18:50.318285 IP ▮▮▮▮▮▮▮▮▮▮▮▮.53256 > 192.168.122.20.sip: SIP: INVITE sip:2600▮▮▮▮▮2170012@144.76.▮▮▮▮▮ SIP/2.0
```

are there any entries and do the phone numbers in `sip:NUMBER@IP` correspond to the numbers in the log? 
if yes: you are getting spammed by SIP bots.

There is section in the official documentation which gives advice for this:
https://docs.bigbluebutton.org/2.2/customize.html#add-a-phone-number-to-the-conference-bridge

> Finally, setup the firewall rules so you are only accepting incoming calls from the IP address of your SIP provider. For example, if your SIP provider forwards incoming calls from 64.2.142.33, then setup the following firewall rules on your server.
> 
> ```
> iptables -A INPUT -i eth0 -p tcp --dport 5060 -s 0.0.0.0/0 -j REJECT
> iptables -A INPUT -i eth0 -p udp --dport 5060 -s 0.0.0.0/0 -j REJECT
> iptables -A INPUT -i eth0 -p tcp --dport 5080 -s 0.0.0.0/0 -j REJECT
> iptables -A INPUT -i eth0 -p udp --dport 5080 -s 0.0.0.0/0 -j REJECT
> iptables -I INPUT  -p udp --dport 5060 -s 64.2.142.33 -j ACCEPT
> ```
> With these rules, you won’t get spammed by bots scanning for SIP endpoints and trying to connect.

if you don't use incoming SIP calls at all, just leave out the last line. And be aware, that iptable rules are not reboot persistent by default.

**Comment by tilllt** [comment]
ah, i didnt think about the existance of sip spam, but of course it exists.
i hadnt yet enabled a firewall i must admit, now i have. 

so this applies to the docker as well i guess, plus the self hosted turn server?
https://docs.bigbluebutton.org/2.2/configure-firewall.html

    TCP/IP port 22 (for SSH)
    TCP/IP ports 80/443 (for HTTP/HTTPS)
    UDP ports in the range 16384 - 32768 (for FreeSWITCH/HTML5 RTP streams)

**Comment by alangecker** [comment]
> so this applies to the docker as well i guess, plus the self hosted turn server?
> https://docs.bigbluebutton.org/2.2/configure-firewall.html

for coturn you need additionally the STUN ports (3478 tcp and udp)
https://docs.bigbluebutton.org/2.2/setup-turn-server.html

**Comment by alangecker** [comment]
seems like your problems are resolved?

I will close that for now. feel free to reopen it again if there are any further problems ;)

**Comment by tilllt** [comment]
Actually, i gave up on it for now, i cannot get it working.
